{
  "$schema": "../schema/jquery-ecosystem.schema.json",
  "schema": "jqstar-jquery-ecosystem/1",
  "reviewedAt": "2026-09-03T12:50:48Z",
  "expiresAt": "2027-03-03T12:50:48Z",
  "reviewPolicy": {
    "maximumAgeDays": 183,
    "triggers": [
      "Before a stable jQStar major release",
      "When an OpenJS project status changes",
      "When a reviewed project publishes a stable release or changes support policy",
      "When the OpenJS trademark policy or written permission changes"
    ],
    "changeProcess": "Recheck primary sources, update this matrix and its downstream digest through a ticket, then rerun static, package, and delivery gates."
  },
  "product": {
    "names": {
      "product": "jQStar",
      "package": "jquery-star",
      "cli": "jqstar",
      "markup": "data-jqs",
      "site": "jqstar.com",
      "legacyCheckout": "jqdatastar"
    },
    "positioning": "An independent HTML-first UI and application library for jQuery.",
    "disclaimer": "jQStar is not affiliated with, sponsored by, endorsed by, or an official successor to the jQuery project or the OpenJS Foundation.",
    "trademarkPolicy": "https://trademark-policy.openjsf.org/",
    "attribution": "jQuery and related project names are trademarks of the OpenJS Foundation or their respective owners and are used here only for factual compatibility and migration statements.",
    "allowedUses": [
      "Factual compatibility statements backed by current tests",
      "Migration guidance that identifies the source and destination products",
      "Ownership attribution and links to official project sources"
    ],
    "forbiddenClaims": [
      "jQuery UI 2",
      "the new jQuery UI",
      "official jQuery successor",
      "OpenJS sponsored",
      "jQuery endorsed"
    ],
    "surfaceReview": [
      {
        "surface": "package-metadata",
        "evidence": ["package.json"],
        "result": "The package uses the independent jquery-star name and factual powered-by-jQuery wording; it declares jQuery only as a peer."
      },
      {
        "surface": "readme",
        "evidence": ["README.md"],
        "result": "The README describes real-jQuery compatibility and migration without an official-project, endorsement, or drop-in jQuery UI claim."
      },
      {
        "surface": "website-titles-copy",
        "evidence": ["example/index.html", "example/docs/ecosystem/index.html"],
        "result": "Titles lead with jQStar; ecosystem names appear only in status, compatibility, attribution, and migration copy."
      },
      {
        "surface": "social-image-assets",
        "evidence": ["example/public/favicon.svg", "example/public/og-jqstar.png"],
        "result": "The custom jQStar mark and social card contain no copied jQuery or OpenJS logo or trade dress."
      },
      {
        "surface": "repository-metadata-topics",
        "evidence": ["https://github.com/Ignibyte/jqstar", "package.json"],
        "result": "The public repository and package keywords make no official, successor, stewardship, sponsorship, or endorsement claim."
      },
      {
        "surface": "examples",
        "evidence": ["example/", "registry/"],
        "result": "Examples use jQStar markup and APIs; no archived project runtime, logo, theme, or Widget Factory implementation is copied."
      },
      {
        "surface": "migration-guides",
        "evidence": [
          "docs/JQUERY_ECOSYSTEM.md",
          "docs/tickets/0039-publish-jquery-ui-migration.md",
          "docs/tickets/0040-publish-jquery-mobile-migration.md"
        ],
        "result": "Guides distinguish factual source-project status from jQStar policy and assign executable migration claims to downstream tickets."
      },
      {
        "surface": "release-notes",
        "evidence": [
          "README.md",
          "docs/PROJECT.md",
          "docs/tickets/0017-prepare-stable-platform-release.md"
        ],
        "result": "Current release surfaces make no third-party ownership claim; ticket 0017 must recheck this matrix before stable-major wording."
      }
    ],
    "futureProposalPrerequisites": [
      "Shipped migration evidence",
      "Sustained independent adoption",
      "Upstream contributions and participation",
      "A concrete governance, security, maintenance, and funding plan",
      "Documented community consultation",
      "Explicit written agreement from the jQuery project and OpenJS Foundation"
    ]
  },
  "projects": [
    {
      "id": "jquery-core",
      "name": "jQuery Core",
      "package": "jquery",
      "officialStatus": "impact",
      "reviewedRelease": "4.0.0",
      "releaseKind": "current-stable",
      "maintenanceStatement": "jQuery 4.x is current and only the latest jQuery release is fully supported; 3.x receives critical security patches and bug fixes.",
      "disposition": "integrate",
      "runtimePolicy": "peer-foundation",
      "jqstarRole": "The application-owned real jQuery instance is jQStar's sole selector, event, collection, and plugin foundation.",
      "testedVersions": ["3.7.1", "4.0.0"],
      "supportedRange": ">=3.7.1 <5",
      "ownerTickets": ["0003", "0004", "0057"],
      "nonGoals": [
        "Vendoring or forking jQuery",
        "Publishing a jQuery-compatible replacement",
        "Changing the invariant that $ is jQuery while $name is a signal"
      ],
      "recheckTriggers": [
        "A jQuery stable release inside or outside the peer range",
        "A jQuery support-policy or OpenJS status change"
      ],
      "sources": [
        {
          "id": "jquery-core.openjs-status",
          "kind": "status",
          "url": "https://github.com/openjs-foundation/cross-project-council",
          "reviewedAt": "2026-09-03T12:50:48Z"
        },
        {
          "id": "jquery-core.release-4.0.0",
          "kind": "release",
          "url": "https://blog.jquery.com/2026/01/17/jquery-4-0-0/",
          "reviewedAt": "2026-09-03T12:50:48Z"
        },
        {
          "id": "jquery-core.support",
          "kind": "support",
          "url": "https://jquery.com/support/",
          "reviewedAt": "2026-09-03T12:50:48Z"
        },
        {
          "id": "jquery-core.upgrade-4.0",
          "kind": "migration",
          "url": "https://jquery.com/upgrade-guide/4.0/",
          "reviewedAt": "2026-09-03T12:50:48Z"
        }
      ]
    },
    {
      "id": "jquery-migrate",
      "name": "jQuery Migrate",
      "package": "jquery-migrate",
      "officialStatus": "jquery-companion",
      "reviewedRelease": "4.0.2",
      "releaseKind": "current-stable",
      "maintenanceStatement": "The official upgrade guide presents Migrate as a temporary development aid whose uncompressed build reports compatibility warnings during staged upgrades.",
      "disposition": "integrate",
      "runtimePolicy": "application-opt-in",
      "jqstarRole": "Application owners may use the matching Migrate release while upgrading jQuery, preserve its warnings, fix each finding, and remove it when the stage is complete.",
      "testedVersions": [],
      "supportedRange": null,
      "ownerTickets": ["0032"],
      "nonGoals": [
        "Bundling, injecting, or auto-loading Migrate",
        "Suppressing warnings",
        "Treating warnings as universally safe automatic rewrites"
      ],
      "recheckTriggers": ["A Migrate stable release", "A jQuery upgrade-guide workflow change"],
      "sources": [
        {
          "id": "jquery-migrate.upgrade-workflow",
          "kind": "migration",
          "url": "https://jquery.com/upgrade-guide/4.0/",
          "reviewedAt": "2026-09-03T12:50:48Z"
        },
        {
          "id": "jquery-migrate.release",
          "kind": "release",
          "url": "https://releases.jquery.com/",
          "reviewedAt": "2026-09-03T12:50:48Z"
        }
      ]
    },
    {
      "id": "jquery-ui",
      "name": "jQuery UI",
      "package": "jquery-ui",
      "officialStatus": "archived",
      "reviewedRelease": "1.14.2",
      "releaseKind": "current-stable",
      "maintenanceStatement": "jQuery UI receives compatibility, security, and important-regression maintenance, with no significant new feature work planned; OpenJS still classifies the project as Archived.",
      "disposition": "coexist-and-migrate",
      "runtimePolicy": "external-only",
      "jqstarRole": "Existing applications may keep isolated jQuery UI regions during measured migration; new work uses jQStar's native semantic components.",
      "testedVersions": [],
      "supportedRange": null,
      "ownerTickets": ["0039"],
      "nonGoals": [
        "A runtime dependency or source fork",
        "Widget Factory, Widget Plugin Bridge, or third-party extension compatibility",
        "ThemeRoller, effects, or imperative plugin API compatibility"
      ],
      "recheckTriggers": [
        "A jQuery UI stable release or maintenance statement change",
        "An OpenJS status change"
      ],
      "sources": [
        {
          "id": "jquery-ui.openjs-status",
          "kind": "status",
          "url": "https://github.com/openjs-foundation/cross-project-council",
          "reviewedAt": "2026-09-03T12:50:48Z"
        },
        {
          "id": "jquery-ui.release-maintenance",
          "kind": "maintenance",
          "url": "https://blog.jqueryui.com/2026/01/jquery-ui-1-14-2-released/",
          "reviewedAt": "2026-09-03T12:50:48Z"
        },
        {
          "id": "jquery-ui.catalog",
          "kind": "catalog",
          "url": "https://api.jqueryui.com/",
          "reviewedAt": "2026-09-03T12:50:48Z"
        }
      ]
    },
    {
      "id": "jquery-mobile",
      "name": "jQuery Mobile",
      "package": "jquery-mobile",
      "officialStatus": "archived",
      "reviewedRelease": "1.4.1",
      "releaseKind": "last-stable",